{
  "acceptanceCriteria": [
    {
      "blocker": null,
      "evidence": [
        "tests/test_layout.py::LayoutTests::test_unknown_languages_receive_generic_buildings"
      ],
      "id": "AC-001",
      "status": "AUTOMATED",
      "summary": "Unknown source languages retain structural districts and generic buildings."
    },
    {
      "blocker": null,
      "evidence": [
        "tests/test_cli.py::CliTests::test_build_repository_creates_deterministic_artifact_set",
        "tests/test_preview.py::PreviewTests::test_preview_is_deterministic_valid_svg"
      ],
      "id": "AC-002",
      "status": "AUTOMATED",
      "summary": "Repeated builds and previews produce identical deterministic artifacts."
    },
    {
      "blocker": null,
      "evidence": [
        "tests/test_layout.py::LayoutTests::test_previous_scene_hint_preserves_colliding_file_positions",
        "tests/test_layout.py::LayoutTests::test_previous_scene_hint_preserves_existing_district_subtrees"
      ],
      "id": "AC-003",
      "status": "AUTOMATED",
      "summary": "Previous-scene hints preserve unaffected building and district anchors across collision fixtures."
    },
    {
      "blocker": null,
      "evidence": [
        "tests/test_java_analyzer.py::JavaAnalyzerTests::test_spring_roles_use_verified_annotations_and_specific_precedence"
      ],
      "id": "AC-004",
      "status": "AUTOMATED",
      "summary": "Real Spring annotations produce five evidence-backed core roles."
    },
    {
      "blocker": null,
      "evidence": [
        "tests/test_java_analyzer.py::JavaAnalyzerTests::test_negative_near_matches_do_not_create_spring_roles"
      ],
      "id": "AC-005",
      "status": "AUTOMATED",
      "summary": "Lookalikes, suffixes, and JPA-only evidence do not fabricate roles or PostgreSQL."
    },
    {
      "blocker": null,
      "evidence": [
        "tests/test_layout.py::LayoutTests::test_edges_between_districts_are_aggregated_without_losing_ids"
      ],
      "id": "AC-006",
      "status": "AUTOMATED",
      "summary": "Three verified relations aggregate into one route retaining every edge ID."
    },
    {
      "blocker": null,
      "evidence": [
        "tests/test_jsts_analyzer.py::JsTsAnalyzerTests::test_ambiguous_and_escaping_relative_imports_stay_unresolved"
      ],
      "id": "AC-007",
      "status": "AUTOMATED",
      "summary": "Ambiguous or unavailable targets remain unresolved without fabricated files."
    },
    {
      "blocker": null,
      "evidence": [
        "tests/test_jsts_analyzer.py::JsTsAnalyzerTests::test_analysis_is_deterministic_and_never_executes_source",
        "tests/test_scanner.py::ScannerTests::test_scanner_never_executes_source_file"
      ],
      "id": "AC-008",
      "status": "AUTOMATED",
      "summary": "Scanning and language analysis never execute repository source."
    },
    {
      "blocker": null,
      "evidence": [
        "tests/test_jsts_analyzer.py::JsTsAnalyzerTests::test_malformed_file_is_skipped_without_losing_safe_files",
        "tests/test_scanner.py::ScannerTests::test_file_limit_returns_bounded_partial_result",
        "tests/test_scanner.py::ScannerTests::test_oversized_file_is_skipped_with_diagnostic"
      ],
      "id": "AC-009",
      "status": "AUTOMATED",
      "summary": "Malformed and oversized input remains bounded while safe partial results survive."
    },
    {
      "blocker": "ADR-007 explicitly defers public repository conversion and Pages activation until maintainer approval; no repository-subpath deployment URL may be verified before that approval.",
      "evidence": [
        "docs/QUALITY_LOG.md",
        "docs/adr/ADR-007.md",
        "tests/test_ci.py::ContinuousIntegrationTests::test_hosted_smoke_job_runs_the_composite_action",
        "tests/test_github_action.py::GithubActionTests::test_action_builds_static_artifacts_and_exports_paths",
        "tests/test_viewer.py::ViewerTests::test_viewer_assets_are_subpath_safe"
      ],
      "id": "AC-010",
      "status": "BLOCKED",
      "summary": "Hosted-runner Action output is proven; explicitly deferred Pages publication remains unverified."
    },
    {
      "blocker": null,
      "evidence": [
        "tests/test_java_analyzer.py::JavaAnalyzerTests::test_local_imports_create_evidenced_file_edges_and_city_networks",
        "tests/test_viewer.py::ViewerTests::test_untrusted_graph_text_is_encoded_as_javascript_data"
      ],
      "id": "AC-011",
      "status": "AUTOMATED",
      "summary": "Inspector inputs retain exact evidence identity and safely encode hostile labels."
    },
    {
      "blocker": null,
      "evidence": [
        "tests/test_java_analyzer.py::JavaAnalyzerTests::test_mixed_repository_discloses_structural_only_coverage"
      ],
      "id": "AC-012",
      "status": "AUTOMATED",
      "summary": "Mixed-language analysis discloses partial semantic coverage."
    },
    {
      "blocker": null,
      "evidence": [
        "tests/test_catalog.py::CatalogContractTests::test_negative_fixture_that_matches_is_rejected"
      ],
      "id": "AC-013",
      "status": "AUTOMATED",
      "summary": "Catalog contribution validation rejects a negative fixture that matches its rule."
    },
    {
      "blocker": null,
      "evidence": [
        "tests/test_city_contract.py::CityContractTests::test_orphan_references_are_rejected",
        "tests/test_viewer.py::ViewerTests::test_invalid_scene_is_rejected"
      ],
      "id": "AC-014",
      "status": "AUTOMATED",
      "summary": "Invalid scene references are rejected by both contract and viewer boundaries."
    }
  ],
  "releaseChecks": [
    {
      "blocker": "AC-010 remains blocked by the explicit ADR-007 publication deferral and later requires an approved Pages deployment plus verified repository-subpath URL.",
      "evidence": [
        "docs/QUALITY_LOG.md",
        "tests/test_release_readiness.py::ReleaseReadinessTests::test_readiness_maps_every_p0_requirement_and_required_acceptance"
      ],
      "id": "ACCEPTANCE_EVIDENCE",
      "status": "BLOCKED",
      "summary": "Required acceptance criteria are mapped, but not all are fully demonstrated."
    },
    {
      "blocker": null,
      "evidence": [
        "tests/test_canonical_json.py::CanonicalJsonTests::test_digest_is_stable_across_key_order",
        "tests/test_city_contract.py::CityContractTests::test_valid_fixture_satisfies_contract",
        "tests/test_stable_ids.py::StableIdTests::test_ucg_fixture_uses_stable_entity_and_edge_ids",
        "tests/test_ucg_contract.py::UcgContractTests::test_valid_fixtures_satisfy_contract"
      ],
      "id": "CONTRACT_BASELINES",
      "status": "AUTOMATED",
      "summary": "Versioned schemas, canonicalization, stable IDs, and baseline fixtures are tested."
    },
    {
      "blocker": null,
      "evidence": [
        "docs/DECISION_AUDIT.md",
        "docs/QUALITY_LOG.md",
        "docs/adr/ADR-002.md",
        "docs/adr/ADR-005.md",
        "tests/test_ci.py::ContinuousIntegrationTests::test_hosted_smoke_job_runs_the_composite_action",
        "tests/test_viewer.py::ViewerTests::test_webgl_renderer_has_explicit_2d_fallback_boundary"
      ],
      "id": "DECISION_COMPLIANCE",
      "status": "AUTOMATED",
      "summary": "DEC-001 through DEC-013 are audited, including genuine WebGL 3D and deterministic non-WebGL rendering paths."
    },
    {
      "blocker": "The clean GitHub-hosted Action succeeds, but ADR-007 defers Pages activation and public repository conversion until explicit maintainer approval.",
      "evidence": [
        "docs/QUALITY_LOG.md",
        "docs/adr/ADR-007.md",
        "tests/test_ci.py::ContinuousIntegrationTests::test_hosted_smoke_job_runs_the_composite_action",
        "tests/test_github_action.py::GithubActionTests::test_action_builds_static_artifacts_and_exports_paths",
        "tests/test_viewer.py::ViewerTests::test_viewer_assets_are_subpath_safe"
      ],
      "id": "FRESH_REPOSITORY_PUBLISHING",
      "status": "BLOCKED",
      "summary": "A fresh hosted Action build is proven; the deliberately deferred opt-in Pages deployment remains unverified."
    },
    {
      "blocker": null,
      "evidence": [
        "tests/test_governance.py::GovernanceTests::test_dependency_inventory_matches_the_python_311_lock",
        "tests/test_governance.py::GovernanceTests::test_security_and_pull_request_policies_cover_release_boundaries"
      ],
      "id": "GOVERNANCE_REVIEW",
      "status": "AUTOMATED",
      "summary": "Security, contribution, ownership, and dependency review policies are tested."
    },
    {
      "blocker": null,
      "evidence": [
        "tests/test_java_analyzer.py::JavaAnalyzerTests::test_local_imports_create_evidenced_file_edges_and_city_networks",
        "tests/test_viewer.py::ViewerTests::test_untrusted_graph_text_is_encoded_as_javascript_data"
      ],
      "id": "INSPECTOR_INTEGRITY",
      "status": "AUTOMATED",
      "summary": "Inspector inputs retain evidence identity and safely encode repository-controlled text."
    },
    {
      "blocker": null,
      "evidence": [
        "tests/test_jsts_analyzer.py::JsTsAnalyzerTests::test_analysis_is_deterministic_and_never_executes_source",
        "tests/test_scanner.py::ScannerTests::test_scanner_never_executes_source_file"
      ],
      "id": "LOCAL_ONLY_PIPELINE",
      "status": "AUTOMATED",
      "summary": "The pipeline runs locally without executing or uploading target repository code."
    },
    {
      "blocker": null,
      "evidence": [
        "tests/test_release_readiness.py::ReleaseReadinessTests::test_readiness_maps_every_p0_requirement_and_required_acceptance",
        "tests/test_scanner.py::ScannerTests::test_spring_properties_emit_only_allowlisted_non_secret_config_evidence"
      ],
      "id": "P0_REQUIREMENTS",
      "status": "AUTOMATED",
      "summary": "Every P0 requirement is mapped to automated repository evidence."
    },
    {
      "blocker": null,